{
  "$schema": "https://json-schema.org/draft/2020-12/schema",
  "$id": "https://velari.local/schemas/packet-manifest.schema.json",
  "title": "Velari Packet Manifest",
  "type": "object",
  "additionalProperties": false,
  "required": [
    "schema_version",
    "packet_id",
    "generated_at",
    "generator",
    "practice",
    "data_boundary",
    "source_profile",
    "overall_risk",
    "sections",
    "evidence_references",
    "findings",
    "roadmap_items",
    "artifacts",
    "limitations"
  ],
  "properties": {
    "schema_version": {
      "const": "2026-05-19"
    },
    "packet_id": {
      "type": "string",
      "pattern": "^pkt_[a-z0-9_]+$"
    },
    "generated_at": {
      "type": "string",
      "format": "date-time"
    },
    "generator": {
      "type": "object",
      "additionalProperties": false,
      "required": [
        "name",
        "mode"
      ],
      "properties": {
        "name": {
          "type": "string"
        },
        "mode": {
          "type": "string"
        }
      }
    },
    "practice": {
      "type": "object",
      "additionalProperties": false,
      "required": [
        "label",
        "type",
        "review_period",
        "staff_count",
        "locations"
      ],
      "properties": {
        "label": {
          "type": "string"
        },
        "type": {
          "type": "string"
        },
        "review_period": {
          "type": "string"
        },
        "staff_count": {
          "type": "integer"
        },
        "locations": {
          "type": "integer"
        }
      }
    },
    "data_boundary": {
      "type": "object",
      "additionalProperties": false,
      "required": [
        "classification",
        "phi_allowed",
        "secrets_allowed",
        "raw_evidence_allowed"
      ],
      "properties": {
        "classification": {
          "type": "string"
        },
        "phi_allowed": {
          "const": false
        },
        "secrets_allowed": {
          "const": false
        },
        "raw_evidence_allowed": {
          "const": false
        }
      }
    },
    "source_profile": {
      "type": "object",
      "additionalProperties": false,
      "required": [
        "path",
        "sha256"
      ],
      "properties": {
        "path": {
          "type": "string",
          "pattern": "^(?!/)(?!.*(?:^|/)\\.\\.(?:/|$))[^\\\\\\u0000]+$"
        },
        "sha256": {
          "type": "string",
          "pattern": "^[a-f0-9]{64}$"
        }
      }
    },
    "overall_risk": {
      "enum": [
        "low",
        "medium",
        "high"
      ]
    },
    "sections": {
      "type": "array",
      "minItems": 10,
      "items": {
        "type": "object",
        "additionalProperties": false,
        "required": [
          "id",
          "title",
          "status",
          "artifact_refs",
          "source_modules"
        ],
        "properties": {
          "id": {
            "enum": [
              "executive_scorecard",
              "ai_findings",
              "vendor_baa_exposure",
              "ephi_map_lite",
              "access_mfa_offboarding",
              "downtime_ransomware",
              "connected_device_inventory",
              "portal_api_flow_review",
              "external_evidence_precheck",
              "incident_decision_log",
              "incident_evidence_timeline",
              "incident_after_action",
              "evidence_index",
              "owner_msp_handoff",
              "roadmap_30_60_90",
              "limitations_appendix"
            ]
          },
          "title": {
            "type": "string"
          },
          "status": {
            "enum": [
              "generated",
              "planned",
              "not_applicable"
            ]
          },
          "artifact_refs": {
            "type": "array",
            "items": {
              "type": "string"
            }
          },
          "source_modules": {
            "type": "array",
            "items": {
              "type": "string"
            }
          }
        }
      },
      "uniqueItems": true,
      "allOf": [
        {
          "contains": {
            "type": "object",
            "properties": {
              "id": {
                "const": "executive_scorecard"
              }
            },
            "required": [
              "id"
            ]
          },
          "minContains": 1
        },
        {
          "contains": {
            "type": "object",
            "properties": {
              "id": {
                "const": "ai_findings"
              }
            },
            "required": [
              "id"
            ]
          },
          "minContains": 1
        },
        {
          "contains": {
            "type": "object",
            "properties": {
              "id": {
                "const": "vendor_baa_exposure"
              }
            },
            "required": [
              "id"
            ]
          },
          "minContains": 1
        },
        {
          "contains": {
            "type": "object",
            "properties": {
              "id": {
                "const": "ephi_map_lite"
              }
            },
            "required": [
              "id"
            ]
          },
          "minContains": 1
        },
        {
          "contains": {
            "type": "object",
            "properties": {
              "id": {
                "const": "access_mfa_offboarding"
              }
            },
            "required": [
              "id"
            ]
          },
          "minContains": 1
        },
        {
          "contains": {
            "type": "object",
            "properties": {
              "id": {
                "const": "downtime_ransomware"
              }
            },
            "required": [
              "id"
            ]
          },
          "minContains": 1
        },
        {
          "contains": {
            "type": "object",
            "properties": {
              "id": {
                "const": "incident_evidence_timeline"
              }
            },
            "required": [
              "id"
            ]
          },
          "minContains": 1
        },
        {
          "contains": {
            "type": "object",
            "properties": {
              "id": {
                "const": "incident_after_action"
              }
            },
            "required": [
              "id"
            ]
          },
          "minContains": 1
        },
        {
          "contains": {
            "type": "object",
            "properties": {
              "id": {
                "const": "evidence_index"
              }
            },
            "required": [
              "id"
            ]
          },
          "minContains": 1
        },
        {
          "contains": {
            "type": "object",
            "properties": {
              "id": {
                "const": "owner_msp_handoff"
              }
            },
            "required": [
              "id"
            ]
          },
          "minContains": 1
        },
        {
          "contains": {
            "type": "object",
            "properties": {
              "id": {
                "const": "roadmap_30_60_90"
              }
            },
            "required": [
              "id"
            ]
          },
          "minContains": 1
        },
        {
          "contains": {
            "type": "object",
            "properties": {
              "id": {
                "const": "limitations_appendix"
              }
            },
            "required": [
              "id"
            ]
          },
          "minContains": 1
        }
      ]
    },
    "evidence_references": {
      "type": "array",
      "items": {
        "$ref": "#/$defs/evidence_reference"
      }
    },
    "findings": {
      "type": "array",
      "items": {
        "$ref": "#/$defs/finding"
      }
    },
    "roadmap_items": {
      "type": "array",
      "items": {
        "$ref": "#/$defs/roadmap_item"
      }
    },
    "artifacts": {
      "type": "array",
      "minItems": 1,
      "items": {
        "$ref": "#/$defs/artifact"
      }
    },
    "limitations": {
      "type": "array",
      "items": {
        "type": "string"
      }
    }
  },
  "$defs": {
    "owner_lane": {
      "enum": [
        "owner",
        "office_manager",
        "msp",
        "vendor",
        "legal_compliance",
        "insurer",
        "clinical_lead",
        "velari_reviewer",
        "incident_responder"
      ]
    },
    "priority": {
      "enum": [
        "critical",
        "high",
        "medium",
        "low"
      ]
    },
    "timeframe": {
      "enum": [
        "this_week",
        "30_days",
        "60_days",
        "90_days",
        "quarterly_refresh"
      ]
    },
    "reviewer_needed": {
      "type": "array",
      "minItems": 1,
      "items": {
        "enum": [
          "owner",
          "office_manager",
          "msp",
          "vendor_owner",
          "legal_or_compliance_reviewer",
          "technical_reviewer",
          "clinical_lead",
          "velari_reviewer",
          "incident_responder"
        ]
      }
    },
    "output_views": {
      "type": "object",
      "additionalProperties": false,
      "required": [
        "owner_summary",
        "msp_task",
        "vendor_question",
        "legal_compliance_note",
        "technical_reviewer_note"
      ],
      "properties": {
        "owner_summary": {
          "type": "string"
        },
        "msp_task": {
          "type": "string"
        },
        "vendor_question": {
          "type": "string"
        },
        "legal_compliance_note": {
          "type": "string"
        },
        "technical_reviewer_note": {
          "type": "string"
        }
      }
    },
    "artifact": {
      "type": "object",
      "additionalProperties": false,
      "required": [
        "path",
        "media_type",
        "sha256",
        "bytes",
        "hash_scope"
      ],
      "properties": {
        "path": {
          "type": "string",
          "pattern": "^(?!/)(?!.*(?:^|/)\\.\\.(?:/|$))[^\\\\\\u0000]+$"
        },
        "media_type": {
          "type": "string"
        },
        "sha256": {
          "type": "string",
          "pattern": "^[a-f0-9]{64}$"
        },
        "bytes": {
          "type": "integer",
          "minimum": 1
        },
        "hash_scope": {
          "const": "file_bytes"
        }
      }
    },
    "lifecycle_status": {
      "enum": [
        "missing",
        "requested",
        "partial",
        "provided",
        "reviewed",
        "stale",
        "outdated",
        "blocked",
        "closed",
        "not_applicable"
      ]
    },
    "closeout_state": {
      "enum": [
        "blocked",
        "needs_evidence",
        "ready_for_review",
        "closed",
        "not_applicable"
      ]
    },
    "evidence_trace": {
      "type": "object",
      "additionalProperties": false,
      "required": [
        "source_kind",
        "source_ref",
        "flow_ids",
        "system_refs",
        "vendor_refs",
        "workflow_refs",
        "artifact_refs",
        "source_modules"
      ],
      "properties": {
        "source_kind": {
          "type": "string"
        },
        "source_ref": {
          "type": "string"
        },
        "flow_ids": {
          "type": "array",
          "items": {
            "type": "string"
          }
        },
        "system_refs": {
          "type": "array",
          "items": {
            "type": "string"
          }
        },
        "vendor_refs": {
          "type": "array",
          "items": {
            "type": "string"
          }
        },
        "workflow_refs": {
          "type": "array",
          "items": {
            "type": "string"
          }
        },
        "artifact_refs": {
          "type": "array",
          "items": {
            "type": "string"
          }
        },
        "source_modules": {
          "type": "array",
          "items": {
            "type": "string"
          }
        }
      }
    },
    "evidence_reference": {
      "type": "object",
      "additionalProperties": false,
      "required": [
        "evidence_id",
        "title",
        "evidence_type",
        "source_kind",
        "source_ref",
        "source_system",
        "owner",
        "status",
        "lifecycle_status",
        "closeout_state",
        "date_observed",
        "next_review_date",
        "sensitivity_boundary",
        "artifact_refs",
        "acceptable_evidence",
        "unsafe_inputs",
        "next_action",
        "closeout_rule",
        "trace",
        "notes"
      ],
      "properties": {
        "evidence_id": {
          "type": "string"
        },
        "title": {
          "type": "string"
        },
        "evidence_type": {
          "type": "string"
        },
        "source_kind": {
          "type": "string"
        },
        "source_ref": {
          "type": "string"
        },
        "source_system": {
          "type": "string"
        },
        "owner": {
          "type": "string"
        },
        "status": {
          "$ref": "#/$defs/lifecycle_status"
        },
        "lifecycle_status": {
          "$ref": "#/$defs/lifecycle_status"
        },
        "closeout_state": {
          "$ref": "#/$defs/closeout_state"
        },
        "date_observed": {
          "type": "string"
        },
        "next_review_date": {
          "type": "string"
        },
        "sensitivity_boundary": {
          "const": "reference_only_no_phi_no_secret"
        },
        "artifact_refs": {
          "type": "array",
          "items": {
            "type": "string"
          }
        },
        "acceptable_evidence": {
          "type": "array",
          "minItems": 1,
          "items": {
            "type": "string"
          }
        },
        "unsafe_inputs": {
          "type": "array",
          "minItems": 1,
          "items": {
            "type": "string"
          }
        },
        "next_action": {
          "type": "string",
          "minLength": 1
        },
        "closeout_rule": {
          "type": "string",
          "minLength": 1
        },
        "trace": {
          "$ref": "#/$defs/evidence_trace"
        },
        "notes": {
          "type": "string"
        }
      }
    },
    "finding": {
      "type": "object",
      "additionalProperties": false,
      "required": [
        "finding_id",
        "section_id",
        "severity",
        "title",
        "owner",
        "evidence_refs",
        "plain_english_summary",
        "why_it_matters",
        "risk_area",
        "affected_workflows",
        "owner_lane",
        "secondary_owner_lane",
        "priority",
        "timeframe",
        "recommended_question",
        "acceptable_evidence",
        "unsafe_inputs",
        "next_action",
        "reviewer_needed",
        "service_context",
        "output_views",
        "owner_view",
        "msp_view",
        "vendor_view",
        "legal_compliance_view",
        "technical_reviewer_view"
      ],
      "properties": {
        "finding_id": {
          "type": "string"
        },
        "section_id": {
          "type": "string"
        },
        "severity": {
          "enum": [
            "low",
            "medium",
            "high",
            "critical"
          ]
        },
        "title": {
          "type": "string"
        },
        "owner": {
          "type": "string"
        },
        "evidence_refs": {
          "type": "array",
          "items": {
            "type": "string"
          }
        },
        "plain_english_summary": {
          "type": "string",
          "minLength": 1
        },
        "why_it_matters": {
          "type": "string",
          "minLength": 1
        },
        "risk_area": {
          "type": "string",
          "minLength": 1
        },
        "affected_workflows": {
          "type": "array",
          "minItems": 1,
          "items": {
            "type": "string"
          }
        },
        "owner_lane": {
          "$ref": "#/$defs/owner_lane"
        },
        "secondary_owner_lane": {
          "$ref": "#/$defs/owner_lane"
        },
        "priority": {
          "$ref": "#/$defs/priority"
        },
        "timeframe": {
          "$ref": "#/$defs/timeframe"
        },
        "recommended_question": {
          "type": "string",
          "minLength": 1
        },
        "acceptable_evidence": {
          "type": "array",
          "minItems": 1,
          "items": {
            "type": "string"
          }
        },
        "unsafe_inputs": {
          "type": "array",
          "minItems": 1,
          "items": {
            "type": "string"
          }
        },
        "next_action": {
          "type": "string",
          "minLength": 1
        },
        "reviewer_needed": {
          "$ref": "#/$defs/reviewer_needed"
        },
        "service_context": {
          "type": "string"
        },
        "output_views": {
          "$ref": "#/$defs/output_views"
        },
        "owner_view": {
          "type": "string"
        },
        "msp_view": {
          "type": "string"
        },
        "vendor_view": {
          "type": "string"
        },
        "legal_compliance_view": {
          "type": "string"
        },
        "technical_reviewer_view": {
          "type": "string"
        }
      }
    },
    "roadmap_item": {
      "type": "object",
      "additionalProperties": false,
      "required": [
        "horizon",
        "priority",
        "action",
        "owner"
      ],
      "properties": {
        "horizon": {
          "enum": [
            "30_days",
            "60_days",
            "90_days"
          ]
        },
        "priority": {
          "type": "integer",
          "minimum": 1
        },
        "action": {
          "type": "string"
        },
        "owner": {
          "type": "string"
        }
      }
    }
  }
}
