{
  "artifacts": [
    {
      "bytes": 1317,
      "hash_scope": "file_bytes",
      "media_type": "text/markdown",
      "path": "readiness-review.md",
      "sha256": "3df3b20f5c046a7d96cd8481329c8c6db0fe3f60448fc439f84ae3b414f1c716"
    },
    {
      "bytes": 1524,
      "hash_scope": "file_bytes",
      "media_type": "text/markdown",
      "path": "ephi-flow-map.md",
      "sha256": "f27ce413e4ae6f06cc0f66e6008f862e492694794107c9e8f591f82de10deb9c"
    },
    {
      "bytes": 1729,
      "hash_scope": "file_bytes",
      "media_type": "text/markdown",
      "path": "vendor-baa-review.md",
      "sha256": "26651d969a0c9b4cde287dfc56299fa04c376e03db405c288358cf64ed343656"
    },
    {
      "bytes": 821,
      "hash_scope": "file_bytes",
      "media_type": "text/markdown",
      "path": "ai-workflow-review.md",
      "sha256": "245f49d6fb047ccfffad997f79539d98dc0a4daf0c278e1a06872004a75d86cb"
    },
    {
      "bytes": 1244,
      "hash_scope": "file_bytes",
      "media_type": "text/markdown",
      "path": "downtime-ransomware-tabletop.md",
      "sha256": "9fe30c073e4b5ff96fb5e37b66f0e727eeb162fcff43ee804b0a31d05c3f637f"
    },
    {
      "bytes": 2243,
      "hash_scope": "file_bytes",
      "media_type": "text/markdown",
      "path": "connected-device-inventory.md",
      "sha256": "801ffaac142df5b834962543ffbad6860f1dd1e75d167a24501169faf385cdd6"
    },
    {
      "bytes": 2066,
      "hash_scope": "file_bytes",
      "media_type": "text/markdown",
      "path": "portal-api-flow-review.md",
      "sha256": "9b90cccf2a0131e4a3acb9ca8fe79368326e78f207c68928e8c90b4f08b8b851"
    },
    {
      "bytes": 3909,
      "hash_scope": "file_bytes",
      "media_type": "text/markdown",
      "path": "external-evidence-precheck.md",
      "sha256": "f39c7b9242483071a8a8ad3b9c9c3549693f8c9f5f7ee105d0937a372538d809"
    },
    {
      "bytes": 2177,
      "hash_scope": "file_bytes",
      "media_type": "text/markdown",
      "path": "incident-decision-log.md",
      "sha256": "d0ae8d44223e47df92901d0a24fbbd6e8c7cd535967e20cb6f34dee87dcc326f"
    },
    {
      "bytes": 13695,
      "hash_scope": "file_bytes",
      "media_type": "text/markdown",
      "path": "incident-evidence-timeline.md",
      "sha256": "be6b29a5e70c9d1e46f3aa6f1505eac6a9935d4a5f11ca322059d4b7ee021a9b"
    },
    {
      "bytes": 4469,
      "hash_scope": "file_bytes",
      "media_type": "text/markdown",
      "path": "incident-after-action-report.md",
      "sha256": "e5228d20fced4d3cd3512e704354b6bc4980d57912973bf1f2df7175d34c528d"
    },
    {
      "bytes": 18929,
      "hash_scope": "file_bytes",
      "media_type": "text/markdown",
      "path": "evidence-binder-index.md",
      "sha256": "d68e5fde1da4225f2a322c0feafd7435e7fbe1ad5a7b452155fe68ac1c928a30"
    },
    {
      "bytes": 13124,
      "hash_scope": "file_bytes",
      "media_type": "text/markdown",
      "path": "owner-msp-handoff.md",
      "sha256": "6ea7ee9f0256aff3fb43659f756619253b7a24fb7d8923cb599d85f360c4f1f8"
    },
    {
      "bytes": 8976,
      "hash_scope": "file_bytes",
      "media_type": "text/markdown",
      "path": "30-60-90-roadmap.md",
      "sha256": "3892f2ee931e14606a402a4d8dbb0ea42fa047b06abbf064ab3bf68ea820b213"
    },
    {
      "bytes": 1418,
      "hash_scope": "file_bytes",
      "media_type": "text/markdown",
      "path": "limitations-appendix.md",
      "sha256": "33567261b7ea0f79aa076d7ae6ebe065b1832567571cd35422b563bfbb4732da"
    },
    {
      "bytes": 77739,
      "hash_scope": "file_bytes",
      "media_type": "text/markdown",
      "path": "review-packet.md",
      "sha256": "a03e267e24115811d009c291adbe709abe5ee5a759a30bdcbb4bc8363d47f0d7"
    },
    {
      "bytes": 82349,
      "hash_scope": "file_bytes",
      "media_type": "text/html",
      "path": "review-packet.html",
      "sha256": "7f456d9165c338b0fe775be9ddf65fe10f69f3957e6fb065f61632c875597f37"
    }
  ],
  "data_boundary": {
    "classification": "synthetic_or_client_reference_metadata_only",
    "phi_allowed": false,
    "raw_evidence_allowed": false,
    "secrets_allowed": false
  },
  "evidence_references": [
    {
      "acceptable_evidence": [
        "tracker inventory",
        "tag manager export",
        "sanitized network request summary",
        "page/workflow label",
        "vendor BAA or authorization review note",
        "privacy reviewer disposition"
      ],
      "artifact_refs": [
        "external-evidence-precheck.md"
      ],
      "closeout_rule": "Close when tracker purpose, data sent, tag placement, vendor relationship, and reviewer disposition are recorded without PHI.",
      "closeout_state": "ready_for_review",
      "date_observed": "2026-05-15",
      "evidence_id": "EXT-TRACKER-SCHEDULER-001",
      "evidence_type": "external_precheck",
      "lifecycle_status": "provided",
      "next_action": "Ask the website vendor and qualified privacy reviewer whether this tracker should be removed or restricted on scheduler pages.",
      "next_review_date": "2026-07-14",
      "notes": "Observation context: connect.facebook.net and graph.facebook.com",
      "owner": "Office Manager",
      "sensitivity_boundary": "reference_only_no_phi_no_secret",
      "source_kind": "external_precheck",
      "source_ref": "EXT-TRACKER-SCHEDULER-001",
      "source_system": "Appointment scheduler",
      "status": "provided",
      "title": "Third-party tracker observed on appointment scheduler",
      "trace": {
        "artifact_refs": [
          "external-evidence-precheck.md"
        ],
        "flow_ids": [],
        "source_kind": "external_precheck",
        "source_modules": [
          "external_precheck"
        ],
        "source_ref": "EXT-TRACKER-SCHEDULER-001",
        "system_refs": [],
        "vendor_refs": [],
        "workflow_refs": []
      },
      "unsafe_inputs": [
        "PHI",
        "patient identifiers",
        "credentials",
        "private URLs",
        "raw logs",
        "screenshots with sensitive data",
        "raw contracts",
        "real incident details",
        "real form submissions",
        "patient-entered details",
        "full intercepted payloads with sensitive data",
        "session cookies",
        "private admin links"
      ]
    },
    {
      "acceptable_evidence": [
        "tracker inventory",
        "tag manager export",
        "sanitized network request summary",
        "page/workflow label",
        "vendor BAA or authorization review note",
        "privacy reviewer disposition"
      ],
      "artifact_refs": [
        "external-evidence-precheck.md"
      ],
      "closeout_rule": "Close when tracker purpose, data sent, tag placement, vendor relationship, and reviewer disposition are recorded without PHI.",
      "closeout_state": "ready_for_review",
      "date_observed": "2026-05-15",
      "evidence_id": "EXT-TRACKER-INTAKE-002",
      "evidence_type": "external_precheck",
      "lifecycle_status": "provided",
      "next_action": "Ask the website vendor to document tag purpose, data sent, and whether the intake workflow should suppress analytics tags pending reviewer decision.",
      "next_review_date": "2026-07-14",
      "notes": "Observation context: googletagmanager.com and google-analytics.com",
      "owner": "Office Manager",
      "sensitivity_boundary": "reference_only_no_phi_no_secret",
      "source_kind": "external_precheck",
      "source_ref": "EXT-TRACKER-INTAKE-002",
      "source_system": "New patient intake",
      "status": "provided",
      "title": "Analytics tag observed on new patient intake page",
      "trace": {
        "artifact_refs": [
          "external-evidence-precheck.md"
        ],
        "flow_ids": [],
        "source_kind": "external_precheck",
        "source_modules": [
          "external_precheck"
        ],
        "source_ref": "EXT-TRACKER-INTAKE-002",
        "system_refs": [],
        "vendor_refs": [],
        "workflow_refs": []
      },
      "unsafe_inputs": [
        "PHI",
        "patient identifiers",
        "credentials",
        "private URLs",
        "raw logs",
        "screenshots with sensitive data",
        "raw contracts",
        "real incident details",
        "real form submissions",
        "patient-entered details",
        "full intercepted payloads with sensitive data",
        "session cookies",
        "private admin links"
      ]
    },
    {
      "acceptable_evidence": [
        "TLS scan summary",
        "certificate expiry and issuer",
        "HTTPS redirect evidence",
        "HSTS status",
        "covered host list",
        "MSP attestation"
      ],
      "artifact_refs": [
        "external-evidence-precheck.md"
      ],
      "closeout_rule": "Close when TLS/certificate posture, covered hosts, redirect behavior, HSTS status, and owner acceptance or remediation are recorded.",
      "closeout_state": "needs_evidence",
      "date_observed": "2026-05-15",
      "evidence_id": "EXT-TLS-PORTAL-003",
      "evidence_type": "external_precheck",
      "lifecycle_status": "requested",
      "next_action": "Ask the MSP or portal vendor for TLS scan summary, certificate expiry, redirect behavior, HSTS status, and covered host list.",
      "next_review_date": "2026-06-14",
      "notes": "Observation context: portal.familydental.example",
      "owner": "MSP Lead",
      "sensitivity_boundary": "reference_only_no_phi_no_secret",
      "source_kind": "external_precheck",
      "source_ref": "EXT-TLS-PORTAL-003",
      "source_system": "Patient portal login",
      "status": "requested",
      "title": "Patient portal TLS and certificate evidence needs confirmation",
      "trace": {
        "artifact_refs": [
          "external-evidence-precheck.md"
        ],
        "flow_ids": [],
        "source_kind": "external_precheck",
        "source_modules": [
          "external_precheck"
        ],
        "source_ref": "EXT-TLS-PORTAL-003",
        "system_refs": [],
        "vendor_refs": [],